{
  "protocol_version": "WDBIP v1.4",
  "schema_version": "wdbip_record_v1_4",
  "canon_version": "RippleLogic v12.4",
  "sgp_link": {
    "applicable": true,
    "version": "SGP v8.3",
    "record_ref": "SGP_GREEN_CORRIDOR_BEARERS_001",
    "note": "Human FPP protections remain full; WDBIP does not infer standing."
  },
  "pcc_link": {
    "pcc_record_id": "PCC_GREEN_CORRIDOR_001",
    "wdbip_record_id": "WDBIP_GREEN_CORRIDOR_001",
    "attachment_mode": "PCC_IMMUTABLE_LOCATOR",
    "unresolved_boundary_items": [
      "D3-to-D6 place-meaning pathway requires mixed-method evidence"
    ],
    "gate_routing_summary": "CSV reopened for accessibility, maintenance capacity, and road-safety controls.",
    "artifact_locator": "release://WDBIP-v1.4/wdbip_worked_example_green_corridor_v1_4.json"
  },
  "run_id": "GREEN_CORRIDOR_EXAMPLE_001",
  "option_id": "SCHOOL_GREEN_CORRIDOR",
  "baseline": "CURRENT_TRAFFIC_CORRIDOR",
  "declared_scopes": [
    "U1_SELF",
    "U2_HOUSEHOLD",
    "U3_COMMUNITY",
    "U4_ORGANIZATION",
    "U5_POLITY",
    "U6_HUMANITY_GLOBAL_COORDINATION",
    "U7_BIOSPHERE"
  ],
  "scope_mode": "FULL_SCOPE",
  "population": "Students, households, school staff, nearby residents, road users, and affected ecological systems",
  "time_horizon": "Construction through 10 years",
  "effect_tokens": [
    {
      "token_id": "E1",
      "claim": "Roadside particulate exposure decreases",
      "primary_dimension": "D7_ENVIRONMENT",
      "boundary_status": "BOUNDARY_RESOLVED",
      "scope_assignment": {
        "represented_scopes": [
          "U3_COMMUNITY"
        ],
        "redundancy_method": "NOT_APPLICABLE",
        "rationale": "The immediate environmental exposure state is measured at the school-corridor community scale."
      },
      "bearer": "School corridor environment and exposed populations",
      "evidence_status": "EVIDENCE_EMPIRICALLY_ESTIMATED",
      "uncertainty": "Moderate; requires post-implementation monitoring",
      "time_window": {
        "window_id": "W_ENV_1",
        "period": "0-10 years",
        "state_timing": "MULTI_PERIOD",
        "lag_note": "See temporal model.",
        "duration_note": "Monitored over declared horizon.",
        "reversibility_note": "Varies by token and implementation."
      },
      "profile": {
        "state": "Roadside particulate exposure decreases",
        "functioning": "Defined in domain-specific monitoring plan.",
        "capacity_resilience": "Requires implementation and maintenance review.",
        "drivers_enabling_conditions": "Program delivery, accessibility, maintenance, local context, and external trends.",
        "lived_experience": "Affected-party evidence collected where relevant.",
        "distribution_worst_affected": "Subgroup review linked at record level.",
        "uncertainty_evidence_status": "Moderate; requires post-implementation monitoring",
        "aggregate_sign": "BENEFICIAL",
        "worst_subgroup_sign": "UNKNOWN",
        "worst_affected_subgroups": [
          "See subgroup review"
        ]
      }
    },
    {
      "token_id": "E2",
      "claim": "Respiratory symptom burden decreases",
      "primary_dimension": "D2_HEALTH",
      "boundary_status": "BOUNDARY_RESOLVED",
      "scope_assignment": {
        "represented_scopes": [
          "U1_SELF"
        ],
        "redundancy_method": "NOT_APPLICABLE",
        "rationale": "The health state is borne by individuals; household and community consequences require separate tokens."
      },
      "bearer": "Students and nearby residents",
      "evidence_status": "EVIDENCE_HYPOTHESIZED",
      "uncertainty": "High until longitudinal health data are available",
      "time_window": {
        "window_id": "W_HEALTH_1",
        "period": "6 months-10 years",
        "state_timing": "MULTI_PERIOD",
        "lag_note": "See temporal model.",
        "duration_note": "Monitored over declared horizon.",
        "reversibility_note": "Varies by token and implementation."
      },
      "profile": {
        "state": "Respiratory symptom burden decreases",
        "functioning": "Defined in domain-specific monitoring plan.",
        "capacity_resilience": "Requires implementation and maintenance review.",
        "drivers_enabling_conditions": "Program delivery, accessibility, maintenance, local context, and external trends.",
        "lived_experience": "Affected-party evidence collected where relevant.",
        "distribution_worst_affected": "Subgroup review linked at record level.",
        "uncertainty_evidence_status": "High until longitudinal health data are available",
        "aggregate_sign": "BENEFICIAL",
        "worst_subgroup_sign": "UNKNOWN",
        "worst_affected_subgroups": [
          "See subgroup review"
        ]
      }
    },
    {
      "token_id": "E3",
      "claim": "Safe walking route choice increases",
      "primary_dimension": "D5_AGENCY",
      "boundary_status": "BOUNDARY_RESOLVED",
      "scope_assignment": {
        "primary_scope": "U1_SELF",
        "represented_scopes": [
          "U1_SELF",
          "U2_HOUSEHOLD"
        ],
        "redundancy_method": "DEDUPLICATION",
        "rationale": "The same route-choice capability is logged once at the individual locus; household coordination consequences are separate."
      },
      "bearer": "Students and households",
      "evidence_status": "EVIDENCE_PARTICIPATORY",
      "uncertainty": "Moderate",
      "time_window": {
        "window_id": "W_AGENCY_1",
        "period": "immediate-3 years",
        "state_timing": "MULTI_PERIOD",
        "lag_note": "See temporal model.",
        "duration_note": "Monitored over declared horizon.",
        "reversibility_note": "Varies by token and implementation."
      },
      "profile": {
        "state": "Safe walking route choice increases",
        "functioning": "Defined in domain-specific monitoring plan.",
        "capacity_resilience": "Requires implementation and maintenance review.",
        "drivers_enabling_conditions": "Program delivery, accessibility, maintenance, local context, and external trends.",
        "lived_experience": "Affected-party evidence collected where relevant.",
        "distribution_worst_affected": "Subgroup review linked at record level.",
        "uncertainty_evidence_status": "Moderate",
        "aggregate_sign": "BENEFICIAL",
        "worst_subgroup_sign": "HARMFUL",
        "worst_affected_subgroups": [
          "See subgroup review"
        ]
      }
    },
    {
      "token_id": "E4A",
      "claim": "Individual nature connection increases",
      "primary_dimension": "D6_MEANING",
      "boundary_status": "BOUNDARY_CONTESTED",
      "scope_assignment": {
        "represented_scopes": [
          "U1_SELF"
        ],
        "redundancy_method": "NOT_APPLICABLE",
        "rationale": "The immediate meaning state is experienced by individual users."
      },
      "bearer": "Students and individual community users",
      "evidence_status": "EVIDENCE_HYPOTHESIZED",
      "uncertainty": "High; culturally sensitive mixed-method assessment required",
      "time_window": {
        "window_id": "W_MEANING_SELF_1",
        "period": "6 months-5 years",
        "state_timing": "MULTI_PERIOD",
        "lag_note": "See temporal model.",
        "duration_note": "Monitored over declared horizon.",
        "reversibility_note": "Varies by token and implementation."
      },
      "profile": {
        "state": "Individual nature connection increases",
        "functioning": "Defined in domain-specific monitoring plan.",
        "capacity_resilience": "Requires implementation and maintenance review.",
        "drivers_enabling_conditions": "Program delivery, accessibility, maintenance, local context, and external trends.",
        "lived_experience": "Affected-party evidence collected where relevant.",
        "distribution_worst_affected": "Subgroup review linked at record level.",
        "uncertainty_evidence_status": "High; culturally sensitive mixed-method assessment required",
        "aggregate_sign": "BENEFICIAL",
        "worst_subgroup_sign": "UNKNOWN",
        "worst_affected_subgroups": [
          "See subgroup review"
        ]
      }
    },
    {
      "token_id": "E4B",
      "claim": "Community place identity increases",
      "primary_dimension": "D6_MEANING",
      "boundary_status": "BOUNDARY_CONTESTED",
      "scope_assignment": {
        "represented_scopes": [
          "U3_COMMUNITY"
        ],
        "redundancy_method": "NOT_APPLICABLE",
        "rationale": "Community place identity is a distinct collective meaning state requiring separate evidence from individual nature connection."
      },
      "bearer": "School community and nearby residents",
      "evidence_status": "EVIDENCE_HYPOTHESIZED",
      "uncertainty": "High; culturally sensitive mixed-method assessment required",
      "time_window": {
        "window_id": "W_MEANING_COMM_1",
        "period": "1-10 years",
        "state_timing": "MULTI_PERIOD",
        "lag_note": "See temporal model.",
        "duration_note": "Monitored over declared horizon.",
        "reversibility_note": "Varies by token and implementation."
      },
      "profile": {
        "state": "Community place identity increases",
        "functioning": "Defined in domain-specific monitoring plan.",
        "capacity_resilience": "Requires implementation and maintenance review.",
        "drivers_enabling_conditions": "Program delivery, accessibility, maintenance, local context, and external trends.",
        "lived_experience": "Affected-party evidence collected where relevant.",
        "distribution_worst_affected": "Subgroup review linked at record level.",
        "uncertainty_evidence_status": "High; culturally sensitive mixed-method assessment required",
        "aggregate_sign": "BENEFICIAL",
        "worst_subgroup_sign": "UNKNOWN",
        "worst_affected_subgroups": [
          "See subgroup review"
        ]
      }